{
  "$schema": "https://json-schema.org/draft/2020-12/schema",
  "$id": "https://aiphone.local/contracts/workflow.schema.json",
  "title": "AIPhone Workflow",
  "type": "object",
  "additionalProperties": false,
  "required": ["schemaVersion", "id", "name", "revision", "nodes", "edges", "templates", "createdAt", "updatedAt"],
  "properties": {
    "schemaVersion": { "const": 1 },
    "id": { "type": "string", "minLength": 1 },
    "name": { "type": "string", "minLength": 1 },
    "revision": { "type": "integer", "minimum": 1 },
    "nodes": {
      "type": "array",
      "items": { "$ref": "#/$defs/node" }
    },
    "edges": {
      "type": "array",
      "items": { "$ref": "#/$defs/edge" }
    },
    "templates": {
      "type": "array",
      "items": { "$ref": "#/$defs/template" }
    },
    "createdAt": { "type": "string", "format": "date-time" },
    "updatedAt": { "type": "string", "format": "date-time" }
  },
  "$defs": {
    "position": {
      "type": "object",
      "additionalProperties": false,
      "required": ["x", "y"],
      "properties": {
        "x": { "type": "number" },
        "y": { "type": "number" }
      }
    },
    "node": {
      "type": "object",
      "additionalProperties": false,
      "required": ["id", "type", "position", "config"],
      "properties": {
        "id": { "type": "string", "minLength": 1 },
        "type": {
          "enum": ["START", "DELAY", "WAIT_IMAGE", "IF_IMAGE", "TAP_IMAGE", "TAP_POINT", "SWIPE", "LAUNCH_APP", "FORCE_STOP_APP", "CREATE_CLONE", "DELETE_CLONE", "CLEAR_CLONE", "LOOP", "SUCCESS", "FAILURE"]
        },
        "position": { "$ref": "#/$defs/position" },
        "config": { "type": "object" }
      }
    },
    "edge": {
      "type": "object",
      "additionalProperties": false,
      "required": ["id", "source", "target"],
      "properties": {
        "id": { "type": "string", "minLength": 1 },
        "source": { "type": "string", "minLength": 1 },
        "target": { "type": "string", "minLength": 1 },
        "sourceHandle": { "type": "string" }
      }
    },
    "template": {
      "type": "object",
      "additionalProperties": false,
      "required": ["id", "name", "fileName", "threshold", "width", "height", "updatedAt"],
      "properties": {
        "id": { "type": "string", "minLength": 1 },
        "name": { "type": "string", "minLength": 1 },
        "fileName": { "type": "string", "minLength": 1 },
        "threshold": { "type": "number", "minimum": 0, "maximum": 1 },
        "width": { "type": "integer", "minimum": 1 },
        "height": { "type": "integer", "minimum": 1 },
        "updatedAt": { "type": "string", "format": "date-time" }
      }
    }
  }
}

